{"$schema":"https://json-schema.org/draft/2020-12/schema","$id":"urn:siso:great-library:research:declassified-government-record:0.1","title":"Declassified Government Document Record (module-local draft)","description":"A provenance-first metadata contract for public government records. This draft is local to the Research module and is not a repository-wide accepted schema.","type":"object","additionalProperties":false,"required":["schema_version","record_type","id","title","record_kind","identity","origin","custody","dates","release","digital_objects","description","relationships","provenance","rights","safety_review","research_state"],"properties":{"schema_version":{"const":"0.1.0"},"record_type":{"const":"declassified_government_document"},"id":{"type":"string","pattern":"^DGR-DOC-[A-Z0-9][A-Z0-9-]{5,}$"},"title":{"type":"string","minLength":1},"record_kind":{"enum":["memorandum","report","cable","briefing","estimate","transcript","hearing","directive","policy","manual","map","photograph","audio","video","dataset","finding_aid","release_manifest","correspondence","legal_record","other"]},"identity":{"type":"object","additionalProperties":false,"required":["canonical_key","external_ids","version_label","version_state"],"properties":{"canonical_key":{"type":"string","minLength":3},"external_ids":{"type":"array","minItems":1,"items":{"type":"object","additionalProperties":false,"required":["scheme","value","source_id"],"properties":{"scheme":{"type":"string","minLength":1},"value":{"type":"string","minLength":1},"source_id":{"$ref":"#/$defs/sourceId"},"notes":{"type":"string"}}}},"version_label":{"type":"string","minLength":1},"version_state":{"enum":["single_observed_version","one_of_multiple_releases","superseded","corrected","withdrawn","unknown"]},"document_family_key":{"type":["string","null"]},"duplicate_candidates":{"type":"array","items":{"type":"string","pattern":"^DGR-DOC-[A-Z0-9][A-Z0-9-]{5,}$"}}}},"origin":{"type":"object","additionalProperties":false,"required":["originating_bodies","creators","jurisdictions","document_type_as_marked"],"properties":{"originating_bodies":{"type":"array","minItems":1,"items":{"type":"string","minLength":1}},"creators":{"type":"array","items":{"type":"string","minLength":1}},"jurisdictions":{"type":"array","minItems":1,"items":{"type":"string","minLength":1}},"document_type_as_marked":{"type":["string","null"]},"recipient_bodies":{"type":"array","items":{"type":"string","minLength":1}},"contractor_or_third_party_contributors":{"type":"array","items":{"type":"string","minLength":1}}}},"custody":{"type":"object","additionalProperties":false,"required":["authoritative_source_id","current_custodian","custody_role","collection","archival_coordinates"],"properties":{"authoritative_source_id":{"$ref":"#/$defs/sourceId"},"current_custodian":{"type":"string","minLength":1},"custody_role":{"enum":["originating_agency","legal_archival_custodian","government_publisher","official_copy_holder","unknown"]},"collection":{"type":["string","null"]},"record_group":{"type":["string","null"]},"series":{"type":["string","null"]},"archival_coordinates":{"type":"object","additionalProperties":false,"required":["box","folder","item","other"],"properties":{"box":{"type":["string","null"]},"folder":{"type":["string","null"]},"item":{"type":["string","null"]},"other":{"type":["string","null"]}}},"custody_notes":{"type":"string"}}},"dates":{"type":"object","additionalProperties":false,"required":["document_date","publication_date","classification_date","declassification_date","release_date","repository_ingest_date","retrieved_at"],"properties":{"document_date":{"$ref":"#/$defs/dateValue"},"publication_date":{"$ref":"#/$defs/dateValue"},"classification_date":{"$ref":"#/$defs/dateValue"},"declassification_date":{"$ref":"#/$defs/dateValue"},"release_date":{"$ref":"#/$defs/dateValue"},"repository_ingest_date":{"$ref":"#/$defs/dateValue"},"retrieved_at":{"type":"string","format":"date-time"}}},"release":{"type":"object","additionalProperties":false,"required":["access_state","normalized_statuses","release_mechanisms","raw_release_decision","original_classification","current_markings","redaction_state","withholding_authorities","release_events"],"properties":{"access_state":{"enum":["public_online","public_onsite","public_by_request","metadata_only","temporarily_unavailable","withdrawn","unknown"]},"normalized_statuses":{"type":"array","minItems":1,"uniqueItems":true,"items":{"enum":["formally_declassified","declassified_in_part","foia_released","foia_released_with_redactions","mdr_released","systematically_released","statutorily_released","discretionarily_released","archival_open","public_unclassified","withdrawn_or_superseded","custody_disputed","unknown"]}},"release_mechanisms":{"type":"array","minItems":1,"uniqueItems":true,"items":{"enum":["foia","mandatory_declassification_review","systematic_declassification_review","automatic_declassification","statutory_release","presidential_determination","discretionary_release","official_publication","archival_opening","unknown"]}},"raw_release_decision":{"type":["string","null"]},"original_classification":{"type":["string","null"]},"current_markings":{"type":"array","items":{"type":"string","minLength":1}},"redaction_state":{"enum":["none_observed","redacted","declassified_in_part","page_or_attachment_withheld","unknown"]},"withholding_authorities":{"type":"array","items":{"type":"string","minLength":1}},"release_events":{"type":"array","items":{"type":"object","additionalProperties":false,"required":["date","event_type","authority","source_id","notes"],"properties":{"date":{"$ref":"#/$defs/dateValue"},"event_type":{"enum":["classified","reviewed","declassified","released","redacted","reprocessed","corrected","withdrawn","republished","transferred","unknown"]},"authority":{"type":["string","null"]},"source_id":{"$ref":"#/$defs/sourceId"},"notes":{"type":"string"}}}}}},"digital_objects":{"type":"array","minItems":1,"items":{"type":"object","additionalProperties":false,"required":["object_id","role","url","availability","authoritative","file_name","mime_type","size_bytes","checksum","observed_at","hash_scope","notes"],"properties":{"object_id":{"type":"string","pattern":"^DGR-OBJ-[A-Z0-9][A-Z0-9-]{5,}$"},"role":{"enum":["metadata_page","public_payload","thumbnail","ocr_text","transcript","finding_aid","release_manifest","other"]},"url":{"type":"string","format":"uri","pattern":"^https://"},"availability":{"enum":["observed_available","metadata_only","onsite_or_request","broken","withdrawn","not_checked"]},"authoritative":{"type":"boolean"},"file_name":{"type":["string","null"]},"mime_type":{"type":["string","null"]},"size_bytes":{"type":["integer","null"],"minimum":0},"checksum":{"type":"object","additionalProperties":false,"required":["algorithm","value"],"properties":{"algorithm":{"enum":["sha256","sha1","md5","none"]},"value":{"type":["string","null"]}}},"observed_at":{"type":"string","format":"date-time"},"hash_scope":{"enum":["exact_downloaded_bytes","reported_by_source","not_downloaded","unknown"]},"notes":{"type":"string"}}}},"description":{"type":"object","additionalProperties":false,"required":["summary","languages","page_count","topics","persons","organizations","places","time_span","text_state"],"properties":{"summary":{"type":"string","minLength":1},"languages":{"type":"array","minItems":1,"items":{"type":"string","minLength":2}},"page_count":{"type":["integer","null"],"minimum":0},"topics":{"type":"array","items":{"type":"string","minLength":1}},"persons":{"type":"array","items":{"$ref":"#/$defs/entityMention"}},"organizations":{"type":"array","items":{"$ref":"#/$defs/entityMention"}},"places":{"type":"array","items":{"$ref":"#/$defs/entityMention"}},"time_span":{"type":"object","additionalProperties":false,"required":["start","end","precision"],"properties":{"start":{"type":["string","null"]},"end":{"type":["string","null"]},"precision":{"enum":["day","month","year","range_approximate","unknown"]}}},"text_state":{"type":"object","additionalProperties":false,"required":["ocr_available","ocr_authority","transcription_available","quality_notes"],"properties":{"ocr_available":{"type":"boolean"},"ocr_authority":{"enum":["source_provided","library_generated","third_party","none","unknown"]},"transcription_available":{"type":"boolean"},"quality_notes":{"type":"string"}}}}},"relationships":{"type":"array","items":{"type":"object","additionalProperties":false,"required":["type","target","evidence","confidence"],"properties":{"type":{"enum":["part_of","attachment_of","version_of","supersedes","corrects","duplicates","references","responds_to","released_with","transferred_to","contextualized_by","related_to"]},"target":{"type":"string","minLength":1},"evidence":{"type":"string","minLength":1},"confidence":{"enum":["confirmed","high","medium","low","unknown"]}}}},"provenance":{"type":"object","additionalProperties":false,"required":["source_receipts","processing_history","completeness_notes"],"properties":{"source_receipts":{"type":"array","minItems":1,"items":{"type":"object","additionalProperties":false,"required":["source_id","locator","observed_at","evidence_kind","content_hash","notes"],"properties":{"source_id":{"$ref":"#/$defs/sourceId"},"locator":{"type":"string","format":"uri","pattern":"^https://"},"observed_at":{"type":"string","format":"date-time"},"evidence_kind":{"enum":["official_metadata","official_payload","official_finding_aid","release_manifest","secondary_discovery","preservation_copy","manual_observation"]},"content_hash":{"type":["string","null"]},"notes":{"type":"string"}}}},"processing_history":{"type":"array","items":{"type":"object","additionalProperties":false,"required":["at","action","agent","tool","result"],"properties":{"at":{"type":"string","format":"date-time"},"action":{"type":"string","minLength":1},"agent":{"type":"string","minLength":1},"tool":{"type":["string","null"]},"result":{"type":"string","minLength":1}}}},"completeness_notes":{"type":"string","minLength":1}}},"rights":{"type":"object","additionalProperties":false,"required":["status","basis","embedded_material_review","reuse_decision","reviewed_at","notes"],"properties":{"status":{"enum":["verified_public_domain_us","permission_or_license_verified","mixed_or_embedded_rights","unknown","restricted"]},"basis":{"type":"string","minLength":1},"embedded_material_review":{"enum":["complete","partial","not_started","not_applicable"]},"reuse_decision":{"enum":["metadata_only","link_only","quote_with_attribution","payload_copy_allowed","payload_copy_prohibited","pending"]},"reviewed_at":{"type":["string","null"],"format":"date"},"notes":{"type":"string"}}},"safety_review":{"type":"object","additionalProperties":false,"required":["tier","privacy","reputational","graphic_or_trauma","operational_security","hazardous_technical","publication_decision","reviewed_at","notes"],"properties":{"tier":{"enum":["standard","enhanced_privacy","hazardous_technical","restricted_metadata_only"]},"privacy":{"enum":["clear","redact_or_minimize","escalate","unknown"]},"reputational":{"enum":["clear","allegation_context_required","escalate","unknown"]},"graphic_or_trauma":{"enum":["clear","content_warning","restricted","unknown"]},"operational_security":{"enum":["clear_historical","summarize_only","withhold","escalate","unknown"]},"hazardous_technical":{"enum":["clear_historical","summarize_only","withhold","escalate","unknown"]},"publication_decision":{"enum":["metadata_and_link","metadata_only","public_summary","payload_allowed","withhold_from_publication","pending"]},"reviewed_at":{"type":["string","null"],"format":"date"},"notes":{"type":"string"}}},"research_state":{"type":"object","additionalProperties":false,"required":["status","metadata_confidence","context_confidence","open_questions","last_reviewed_at"],"properties":{"status":{"enum":["discovered","metadata_captured","version_linked","contextualized","reviewed","published","superseded"]},"metadata_confidence":{"enum":["high","medium","low","unknown"]},"context_confidence":{"enum":["high","medium","low","unknown"]},"open_questions":{"type":"array","items":{"type":"string","minLength":1}},"last_reviewed_at":{"type":"string","format":"date"}}}},"$defs":{"sourceId":{"type":"string","pattern":"^DGR-SRC-[A-Z0-9][A-Z0-9-]+$"},"dateValue":{"type":"object","additionalProperties":false,"required":["value","precision","basis","notes"],"properties":{"value":{"type":["string","null"]},"precision":{"enum":["datetime","day","month","year","range","unknown"]},"basis":{"enum":["document_marking","repository_metadata","release_manifest","inferred","unknown"]},"notes":{"type":"string"}}},"entityMention":{"type":"object","additionalProperties":false,"required":["label","role","identity_state"],"properties":{"label":{"type":"string","minLength":1},"role":{"type":["string","null"]},"identity_state":{"enum":["literal_unresolved","matched_public_entity","ambiguous","private_or_sensitive","unknown"]},"external_id":{"type":["string","null"]}}}}}
