{"schema_version":"0.1.0","record_type":"declassified_government_document","id":"DGR-DOC-CIA-RDP96-00788R001500090010-7","title":"INSCOM CENTER LANE PROJECT","record_kind":"memorandum","identity":{"canonical_key":"cia:reading-room:CIA-RDP96-00788R001500090010-7","external_ids":[{"scheme":"CIA_FOIA_ESDN_CREST","value":"CIA-RDP96-00788R001500090010-7","source_id":"DGR-SRC-CIA-READING-ROOM","notes":"Copied from the official metadata page."}],"version_label":"official CIA Reading Room public metadata page observed 2026-08-07","version_state":"single_observed_version","document_family_key":"stargate:center-lane:1984-07-17","duplicate_candidates":[]},"origin":{"originating_bodies":["United States Army Intelligence and Security Command"],"creators":[],"jurisdictions":["United States"],"document_type_as_marked":"Memorandum","recipient_bodies":["Assistant Chief of Staff for Intelligence"],"contractor_or_third_party_contributors":[]},"custody":{"authoritative_source_id":"DGR-SRC-CIA-READING-ROOM","current_custodian":"CIA FOIA Electronic Reading Room public copy","custody_role":"official_copy_holder","collection":"STARGATE","record_group":null,"series":null,"archival_coordinates":{"box":null,"folder":null,"item":"Sequence Number 10","other":"CIA Reading Room document page"},"custody_notes":"This record demonstrates the metadata contract only. Legal custody and complete transfer history have not yet been reconstructed from NARA or agency records."},"dates":{"document_date":{"value":"1984-07-17","precision":"day","basis":"repository_metadata","notes":"Official page labels this as the publication date; the scan should be checked page by page."},"publication_date":{"value":"1984-07-17","precision":"day","basis":"repository_metadata","notes":"Raw CIA Reading Room field."},"classification_date":{"value":null,"precision":"unknown","basis":"unknown","notes":"Not asserted from the public metadata page."},"declassification_date":{"value":null,"precision":"unknown","basis":"unknown","notes":"Do not equate release date with the formal declassification decision without a receipt."},"release_date":{"value":"2004-05-13","precision":"day","basis":"repository_metadata","notes":"Raw CIA Reading Room field."},"repository_ingest_date":{"value":"2016-11-04","precision":"day","basis":"repository_metadata","notes":"The official page labels this as Document Creation Date; treated here as repository metadata, not the historical memorandum date."},"retrieved_at":"2026-08-07T03:00:00+07:00"},"release":{"access_state":"public_online","normalized_statuses":["formally_declassified"],"release_mechanisms":["unknown"],"raw_release_decision":"RIPPUB","original_classification":"S","current_markings":["Approved For Release 2004/07/09"],"redaction_state":"unknown","withholding_authorities":[],"release_events":[{"date":{"value":"2004-05-13","precision":"day","basis":"repository_metadata","notes":"Public metadata release date."},"event_type":"released","authority":null,"source_id":"DGR-SRC-CIA-READING-ROOM","notes":"Mechanism and formal decision authority require page-level or release-manifest verification."}]},"digital_objects":[{"object_id":"DGR-OBJ-CIA-RDP96-00788R001500090010-7-METADATA","role":"metadata_page","url":"https://www.cia.gov/readingroom/document/cia-rdp96-00788r001500090010-7","availability":"observed_available","authoritative":true,"file_name":null,"mime_type":"text/html","size_bytes":null,"checksum":{"algorithm":"none","value":null},"observed_at":"2026-08-07T03:00:00+07:00","hash_scope":"not_downloaded","notes":"The module does not contain the 95-page PDF payload. A future ingestion lane should capture exact attachment bytes and SHA-256 only after rights and safety review."}],"description":{"summary":"A 1984 Army memorandum concerning the INSCOM CENTER LANE project, preserved in the CIA Reading Room's STARGATE collection.","languages":["en"],"page_count":95,"topics":["STARGATE","CENTER LANE","remote viewing","Army intelligence programme history"],"persons":[],"organizations":[{"label":"United States Army Intelligence and Security Command","role":"originating body","identity_state":"literal_unresolved","external_id":null}],"places":[],"time_span":{"start":"1984-07-17","end":"1984-07-17","precision":"day"},"text_state":{"ocr_available":true,"ocr_authority":"source_provided","transcription_available":false,"quality_notes":"The official page exposes body text, but OCR accuracy and page completeness have not been audited."}},"relationships":[{"type":"part_of","target":"DGR-COLL-003","evidence":"The official page assigns the record to the STARGATE collection; the module collection is the research projection.","confidence":"confirmed"},{"type":"contextualized_by","target":"research/remote-viewing","evidence":"The separate Remote Viewing Research & Practice module owns the evidence and practice synthesis.","confidence":"high"}],"provenance":{"source_receipts":[{"source_id":"DGR-SRC-CIA-READING-ROOM","locator":"https://www.cia.gov/readingroom/document/cia-rdp96-00788r001500090010-7","observed_at":"2026-08-07T03:00:00+07:00","evidence_kind":"official_metadata","content_hash":null,"notes":"Metadata fields manually transcribed from the official page; exact page and payload hashes are pending."}],"processing_history":[{"at":"2026-08-07T03:00:00+07:00","action":"create example metadata record","agent":"Great Library declassified-records research lane","tool":"manual transcription from official metadata page","result":"Schema example created without copying the document payload."}],"completeness_notes":"This is deliberately an incomplete example. It proves field shape and uncertainty handling; it is not a certified archival catalog record or a full content assessment."},"rights":{"status":"mixed_or_embedded_rights","basis":"The item is hosted by a U.S. government agency, but embedded or contractor-created material has not been reviewed.","embedded_material_review":"not_started","reuse_decision":"link_only","reviewed_at":"2026-08-07","notes":"Public access is not treated as blanket permission to republish every page or embedded item."},"safety_review":{"tier":"standard","privacy":"unknown","reputational":"clear","graphic_or_trauma":"clear","operational_security":"clear_historical","hazardous_technical":"clear_historical","publication_decision":"metadata_and_link","reviewed_at":"2026-08-07","notes":"Only public metadata and an official locator are included. Full payload review remains a promotion gate."},"research_state":{"status":"metadata_captured","metadata_confidence":"medium","context_confidence":"medium","open_questions":["What declassification mechanism and decision authority produced the public copy?","Does NARA or DIA hold an authoritative transfer or series record?","Are there additional release versions or attachments with different redactions?","Does the public payload contain third-party material with separate rights?"],"last_reviewed_at":"2026-08-07"}}
